{
  "id": "yourcompany.phaser",
  "name": "SDK PHASER",
  "package_version": "1.0.0",
  "minimum_host_version": "0.1.0",
  "maximum_host_version": "0.2.0",
  "process": "phaser_process",
  "reset": "phaser_reset",
  "render": "phaser_render",
  "state_words": 5,
  "tail_seconds": 0,
  "parameters": [
    {"name": "RATE", "unit": "x0.1Hz", "min": 1, "max": 50, "default": 5},
    {"name": "DEPTH", "unit": "%", "min": 0, "max": 100, "default": 75}
  ]
}
